{
  "schema_version": 1,
  "task_id": "secrets-known-exposure",
  "outcome": "Contain self-controlled propagation and invoke the credential response path",
  "scope": {
    "include": [
      "stop own output",
      "non-secret exposure evidence",
      "response escalation"
    ],
    "exclude": [
      "credential rotation",
      "credential deletion",
      "unauthorized external shutdown"
    ]
  },
  "resource_refs": [
    "credential-ref:fixture-build-publisher",
    "exposure-event:fixture-A"
  ],
  "requested_actions": [
    "operation.inspect",
    "operation.stop-own-output"
  ],
  "forbidden_actions": [
    "credential.rotate",
    "credential.delete"
  ],
  "signals": {
    "persistent_program": false,
    "controlled_comparison": false,
    "secret_risk": "required"
  },
  "required_gates": [
    "secret-scan"
  ],
  "baseline_identity": "retained build log event A",
  "stop_conditions": [
    "The action would repeat secret material or exceed containment authority"
  ],
  "expires_on": [
    "task-end",
    "profile-change",
    "response-owner-decision"
  ]
}
